"ID","Term_Description","Fold_Enrichment","occurrence","support","lowest_p","highest_p","Up_regulated","Down_regulated"
"GO:0000977","RNA polymerase II transcription regulatory region
sequence-specific DNA binding",1.0993737,5,0.0151515,2.6e-06,0.0016,"ATF1, CDC5L, ATF2, DACH1, E2F3, E2F6, NR3C1, HIF1A,
HOXD3, HOXD8, HSF2, MEF2A, MEF2C, NFKB1, PBX2, PLAGL1, RFX5, RFXAP,
RORA, SATB1, SNAI1, SP1, SP3, STAT1, TFDP1, TFDP2, NR2C2, TRPS1, VEZF1,
ZNF175, PRDM2, HESX1, NR1I2, ZBED4, ZBTB5, NR1I3, ATF6, SATB2, ADNP,
TBX22, TBX20, IKZF5, ZBTB10, CREBRF","AEBP1, RUNX3, CEBPB, CUX1, DBP, E2F2, E4F1, ENO1,
ETV6, FOXF1, FOXF2, FOXM1, FOSL2, IRF1, LMX1B, MAX, MEF2D, MNT, RARA,
RELA, RPS3, RREB1, RXRA, RXRB, SREBF1, STAT6, BARX2, RFXANK, NR1D1,
DEAF1, ATF5, MLXIP, KLF15, ETV7, CASZ1, ZBTB4, ZBED2, OSR2"
"GO:0042162","telomeric DNA binding",1.3065727,9,0.025,2.9e-06,0.0031,"NCL, TERF1, XRCC5, SMG1, POT1, UPF2, UPF3A, ZBTB10,
PIF1","HNRNPD, UPF1, TERF2, SMG5, TINF2, ACD, CTC1"
"GO:0050750","low-density lipoprotein particle receptor
binding",1.5515551,4,0.0051042,2.9e-06,0.0023,"CLTC, DNAJA1, SYT1, HSP90B1, PICALM, LANCL1,
ANKRA2","AP2A1, APBB1, APOB, APOE, AP2M1, CLU, HSPG2, LRPAP1,
SNX17, APBB3, LDLRAP1, PCSK9"
"GO:0034236","protein kinase A catalytic subunit binding",1.6682134,6,0.0305208,3.1e-06,0.0078,"GSK3B, PKIA, PRKAR1A, PRKAR2A, PRKAR2B, RYR2,
PJA2","CSK, GSK3A, KCNQ1, SMO, SOX9, EZR"
"GO:0004712","protein serine/threonine/tyrosine kinase
activity",1.2832411,8,0.0375,3.2e-06,0.026,"PRKAA2, MAP2K1, RPS6KB1","AKT1, PRKACA, MAP2K2, RPS6KA1, AURKC, AURKB,
TNK2"
"GO:1990381","ubiquitin-specific protease binding",1.4115652,9,0.045,4.3e-06,0.014,"CLTC, SUMO1, CHMP3, LCOR","RAD23A, VCP, BAG6, SPATA2, PARK7, DERL1, SYVN1"
"GO:0031369","translation initiation factor binding",1.4971146,7,0.0260417,4.3e-06,0.0068,"DDX3X, FMR1","EIF4EBP1, EIF4G1, EIF2B4, EIF2B5, TRIM32, LARP1,
TBL2, DAPL1"
"GO:0031490","chromatin DNA binding",1.006061,10,0.075,4.7e-06,0.01,"DHX9, EZH2, HNRNPU, CLOCK","HSF1, PER1, RARA, RELA, RUVBL2, WBP2, GRHL1, SIRT6,
GRHL3, GRHL2"
"GO:0043024","ribosomal small subunit binding",1.5569992,10,0.0525,4.8e-06,0.022,"DDX3X, MTIF2, NPM1, G3BP1, USP16, DHX29, PTCD3","NME1, PIM1, UNG, EIF1, LARP1, ERAL1"
"GO:0101005","deubiquitinase activity",1.43723,6,0.015,5.3e-06,0.011,"USP9X, USP14, USP15, STAMBP, USP25, ZRANB1, USP47,
YOD1, USP28, USP44, USP48","OTUD5"
"GO:0015631","tubulin binding",1.2898218,6,0.0385417,5.8e-06,0.0039,"PRNP, CLIP1, TPR, UNC5C, CEP135, KIF14, AGTPBP1,
RABGAP1, IFT81, CENPJ, MAP7D3, PHF6, AGBL4, LRRK2, TTLL6","ALDOA, DCTN1, GJA1, NUMA1, RPS3, TPPP, ATF5, TTLL12,
EML2, TPPP3, MAP1S, AGBL5, RITA1"
"GO:0050681","nuclear androgen receptor binding",1.0364639,5,0.010101,6.3e-06,0.01,"DDX5, RNF6, TMF1, KDM4C, KDM3A, NSD1","CALR, DAXX, PKN1, SMARCA4, TGFB1I1, ARID5A, PARK7,
ZBTB7A, WIPI1"
"GO:0008270","zinc ion binding",1.2589373,9,0.05,6.5e-06,0.02,"ADH5, BIRC2, BLM, BMI1, CALB1, CBLB, CYLD, GLO1,
GRIN2B, GTF2B, IDE, KPNB1, LIMS1, MDM2, MDM4, KMT2A, MME, MMP8, MMP16,
MNAT1, NT5E, PEX12, PGGT1B, PHEX, POLA1, PRIM1, RABGGTB, RAG1, KDM5A,
RNF2, CLIP1, S100A5, ZEB1, ZNF22, ZNF146, KAT6A, EEA1, KLF7, TNKS,
TRIM24, RNF8, ADAMTS4, PHF14, SEC24D, RASGRP1, LANCL1, SEC24B, SEC23A,
SLU7, USP16, CTCF, ZMYND11, SEC24A, DUSP12, USP33, MYCBP2, KDM4C, TAB2,
ZMYND8, BHMT2, ARIH1, RCHY1, RNF11, C11orf54, ZCCHC4, UHRF1, DHH, APIP,
TET2, RNF125, THAP1, ACER3, POLR3B, ACE2, IFIH1, NSD1, IKZF5, SUV39H2,
UBA5, TET1, CXXC4, KDM7A, CDADC1, NUDT12, POLR1B, ALKBH8, ESCO1,
DNAJC24, ACMSD, PTGR2, RC3H1, TET3, PRIMPOL, KDM1B, NAPEPLD, MSRB3,
ZDHHC20, TAB3","ADA, ADAM8, ALAD, CA9, CAD, CALR, CD4, CDA, CHD4,
CPA2, CRIP1, CRIP2, CSRP1, ACE, DPEP1, ECE1, FNTB, GALT, GRIN2A, LTA4H,
MBD1, MT1F, MT1X, MT2A, NQO2, P2RX4, CHMP1A, PDE2A, POLR2A, POLR2L,
PPARG, RABIF, RNF5, RPS29, RXRA, S100A8, S100A9, S100A12, S100A13, SHH,
SKI, SMPD1, SNCA, SNRPC, SOD1, TIMP1, TIMP2, TK1, TP53, ZNF185, KDM5C,
BBOX1, PDXK, RGN, LITAF, KDM4A, KMT2B, DPP3, TRIM28, PITRM1, RASSF1,
RPH3A, MSRB2, SIRT2, KDM2A, ATP13A2, SIRT3, ISCU, CBLC, PLA2G15, QPCT,
TIMM13, TIMM10, TIMM8B, SMPDL3B, SIRT6, POLR3K, MSRB1, ADA2, FBXL19,
QPCTL, SLC39A4, HIF1AN, THAP11, DHX58, SHANK3, APOBEC3F"
"GO:0042054","histone methyltransferase activity",1.4115652,9,0.04,6.8e-06,0.032,"EZH2, EED, SUZ12, PRMT6, KMT2C, SETD7","PRMT1, SUV39H1, CARM1, NTMT1, DOT1L"
"GO:0032977","membrane insertase activity",1.4596867,6,0.0127083,6.9e-06,0.024,"EMC2, MMGT1, COX18","GET3, EMC8, MTCH1, MTCH2, TIMM10, EMC9, EMC3, EMC7,
EMC6, EMC10"
"GO:0008134","transcription factor binding",1.2249119,4,0.0077083,7.3e-06,0.0073,"DDX3X, HMGB2, IFI16, PPID, PSMD10, TFDP2, SUMO1","FHL2, IGHMBP2, PIM1, PSMC5, UBE2I, ARID5A, WWP2,
DACT2"
"GO:0051059","NF-kappaB binding",1.293507,7,0.015,8.1e-06,0.0063,"GSK3B, HDAC2, NPM1, TAF4B, TP53BP2, BCL10, SETD6,
CDK5RAP3, MTDH","HDAC1, NFKBIA, RELA, HDAC3, CPNE1, BRMS1, HIF1AN,
RNF25, COMMD7"
"GO:0019902","phosphatase binding",1.1346553,2,0.005,8.6e-06,1.4e-05,"CRY1, DLG1, DLG3, NFATC2, PPP3R1, DZIP3, MAGI2,
RCAN3, SH3YL1, CEP192, CSRNP2, FCRL3, SPRED1, CNST","CRY2, MAPK3, PPP1R11, TSC2, ELL, SFI1, MAST2,
TRPC4AP, SIGLEC10, SH3RF2"
"GO:0002020","protease binding",1.3835404,6,0.022601,9.5e-06,0.031,"BRCA2, CD28, GSK3B, ITGAV, ITGB1, ITGB3, SERPINA5,
PRNP, SRI, THBS1, TTN, CRADD, TNFRSF10A, CFLAR, BCL10, ADAMTS4, RNF139,
BANK1, LONP2, SLC2A13, RFFL, CCBE1, THAP5","ACR, ANXA2, SERPINC1, CD70, COL1A1, COL1A2, COL3A1,
COMP, CST3, CSTA, CSTB, DPP4, DVL3, ECM1, F2RL1, FN1, INSL3, ITGA3,
FURIN, SERPINA1, SERPINB6, SERPINB13, SERPINF2, PSAP, SERPINB3,
SERPINB4, STIM1, TIMP2, TNF, TNFAIP3, TP53, UBC, VWF, FADD, F2RL3,
FLOT1, ADRM1, PYCARD, ADAMTSL4, FAM20C, CD177, PINK1, DERL1, TYSND1"
"GO:0044325","transmembrane transporter binding",1.2437567,7,0.0151515,1.2e-05,0.0085,"ANK2, CALM2, CAMK2D, DLG1, FGF13, FHL1, FMR1, ITPR2,
PKD2, FXYD1, TRAPPC2, SLC5A3, SLC8A1, SRI, YES1, USP10, HOMER1, AKAP6,
BAG2, ABCC9, AKAP9, GPD1L, CABP4, GOPC, LRRK2, RNF207, LRRC52","ACTN1, ACTN3, ATP2A3, BAK1, CALM1, CALM3, CDH5,
AP2M1, DIAPH1, FKBP1A, FKBP1B, FLNA, HTT, KCNB1, KCND3, KCNQ1, NOS1,
PRKCSH, S100A10, SCN4B, SNTA1, SRC, VDAC1, YWHAH, HAP1, HERPUD1, RIMS3,
CHERP, NEDD4L, KCNE4, PHPT1, RANGRF, PACS1, SCN3B, RIMS4, LRRC55"
"GO:0070063","RNA polymerase binding",1.3474031,8,0.0628535,1.2e-05,0.045,"BRCA1, CCNT1, CCNT2, DHX9, NEDD4, PKN2, PABPN1,
TCERG1, YTHDC2","PPIB, ZFP36, PHRF1"
"GO:0015035","protein-disulfide reductase activity",1.4795015,7,0.03,1.3e-05,0.045,"PDIA4, PDIA6, DNAJC10, TMX3, PDIA2, TMX1, TXNDC5","GFER, PDIA3, P4HB, TXN, CCS, SCO2, CHCHD4"
"GO:0140938","histone H3 methyltransferase activity",1.5851801,6,0.0100505,1.3e-05,0.049,"MECOM, EZH2, SETD2, PRMT6, ASH1L, KMT2E, SMYD2,
PRDM16, NSD1, SUV39H2, SETD7, SETDB2","SUV39H1, SETD1B, DOT1L"
"GO:0106310","protein serine kinase activity",1.5398893,7,0.02,1.4e-05,0.011,"DYRK1A, GSK3B, PIK3CB, PIK3CG, PRKD1, PRKG2","CSNK1D, PLK1, PRKACA, PRKCD, PRKD2, PINK1"
"GO:0031491","nucleosome binding",1.097884,6,0.0076042,1.9e-05,0.024,"MLLT10, CHD1L, L3MBTL1, HP1BP3, GLYR1, RNF168,
RNF169","RNF4, NOC2L, SIRT6, DNTTIP1"
"GO:0046875","ephrin receptor binding",1.2974993,6,0.0100505,1.9e-05,0.031,"CBL, CRK, EFNA5, EFNB2, PIK3CG","ABL1, EFNA1, EFNA3, EFNA4, EFNB1, FYN, GRB2, SRC"
"GO:0005198","structural molecule activity",1.2376147,7,0.035,2.1e-05,0.023,"ASPH, STX2, PLP1, MATR3, BVES, PANX1, TMEM30A","APOE, CRYAB, FGB, HMGCL, HMOX1, LLGL1, MAP4, NUMA1,
ODF2, SPRR1A, SPRR1B, SPRR2E, TUBA1A, MAP7, KRT75, LAMC3, TUBA1B, OLFM4,
DCTN3, MAPK8IP2, TUBG2, PANX2, TUBA1C, TUBB"
"GO:0000995","RNA polymerase III general transcription initiation
factor activity",1.43723,6,0.0100505,2.3e-05,0.0023,"SNAPC1, GTF3C4, GTF3C3","GTF3C1, GTF3C2, SNAPC4, GTF3C5, GTF3C6"
"GO:0046974","histone H3K9 methyltransferase activity",1.6168837,2,0.0075253,2.3e-05,0.0023,"MECOM, SETD5, ASH1L, PRDM16, SUV39H2, SETDB2","SUV39H1, EHMT2, EHMT1"
"GO:0035091","phosphatidylinositol binding",1.5040779,1,0.005,2.4e-05,2.4e-05,"HIP1, ITPR1, MTM1, SLC9A3, SNX1, SNX4, SNX13, PITPNB,
APPL1, SH3YL1, SNX5, APPL2, CCDC88A, ESYT2, SNX16, FCHO2, MITD1,
EXOC8","FES, GRB7, MAPT, MYO1E, NUMA1, PITPNA, TULP3, HIP1R,
PITPNM1, SNX17, C2CD2L, MCF2L, SNX8, SNX12, BCAS3, PHF12, TNFAIP8L3,
NCF1"
"GO:0048487","beta-tubulin binding",1.5067734,5,0.015625,2.6e-05,0.00096,"BBS4, FGF13, SPAST, SMC3, VAPB, DLEC1, LRPPRC, CCT5,
APPL1, EML4, RACGAP1, ARL8B, TAOK1, TTLL7, IFT74","EMD, HTT, PEX14, TBCD, UXT, GJB6, GABARAP, GABARAPL1,
BCAS3, MAP1S, ARL8A"
"GO:0060090","molecular adaptor activity",1.3004786,9,0.0729167,2.7e-05,0.0033,"ADAM10, AR, CAPN3, CDKN1B, EEF1A1, FNTA, ITGA2B,
MLLT3, NCBP1, NFATC2, PCM1, PRNP, PTPN11, RB1, MAP2K4, ITSN1, SP1, VHL,
OFD1, LAMTOR3, BECN1, IQGAP1, AKAP6, TANK, AKAP9, DZIP1, CNOT1, TAB2,
SASH1, GIGYF2, DYNC1LI1, OTUD4, MICAL3, NKAP, WWC2, CEP63, TBC1D31,
RICTOR, TAB3","AGER, APBB1, ARRB2, COL4A2, E2F1, EIF4G1, HMGA1,
HTN3, IFI27, KIR3DL1, MECP2, MYD88, PLCB3, PML, PSMD4, SLC9A1, SMARCD1,
SNCA, SPI1, TAPBP, TRAF2, TYROBP, VIM, NELFA, BAG6, AXIN1, DHX16, EIF3B,
TRADD, FADD, MBD2, RAB11FIP3, RBX1, TAB1, LAMTOR5, PRDX4, GCN1, RBPMS,
TREX2, WWC1, ISCU, LAMTOR2, FIS1, ECSIT, TOLLIP, LAMTOR1, WWC3, PSMG2,
MAVS, RRAGD, RRAGC, UBE2Z, PSMG3, UBL7, NKD2, MIDN, TICAM1, LAMTOR4"
"GO:0030544","Hsp70 protein binding",1.2389914,6,0.0051294,3.9e-05,0.009,"GPR37, DNAJA1, PPID, TSC1, SACS, DNAJC2, DNAJC10,
DNAJB14, IQCG, METTL21A, RNF207","CYP2E1, DNAJB2, DNAJB1, MVD, RPS3, SNCA, STUB1,
DNAJB12, NOD2"
"GO:0016018","cyclosporin A binding",1.5851801,5,0.0052083,4e-05,0.024,"NKTR, PPID, PPP3CA, PPP3R1, RANBP2, PPIG, CWC27,
PPWD1, PPIL1","PPIA, PPIB, PPIF, PPIE, PPIH, PPIL2"
"GO:0000149","SNARE binding",1.3973069,5,0.010101,4e-05,0.022,"SYT1, PICALM, STX7, SEC24D, NBAS, STX17, LRRK2","SNCA, STXBP1, VAMP2, NAPA, VTI1B, CAPN10, SNAPIN"
"GO:0034452","dynactin binding",1.6332159,5,0.0052083,4.1e-05,0.006,"BBS4, BICD1, GSK3B, PAFAH1B1, SNX5, SNX6, HOOK3","HTT, MAPT, BICD2"
"GO:0043995","histone H4K5 acetyltransferase activity",1.1432511,5,0.01,4.4e-05,0.0026,"KAT6A, ING3, JADE1","BRPF1, KAT7, JADE2, KAT8"
"GO:0043996","histone H4K8 acetyltransferase activity",1.1432511,5,0.01,4.4e-05,0.0026,"KAT6A, ING3, JADE1","BRPF1, KAT7, JADE2, KAT8"
"GO:0004708","MAP kinase kinase activity",1.6332159,5,0.010101,4.5e-05,0.0073,"BRAF, MAPK14, PAK3, MAP2K1, MAP2K6, MAPKAPK5","MAP2K2, MAP2K3, MAP2K7, MAPKAPK3"
"GO:0043539","protein serine/threonine kinase activator
activity",1.2269036,7,0.010101,4.5e-05,0.0066,"CALM2, DDX3X, NBN, MAP2K1, STK3, STK4, IQGAP1, RAD50,
SPRY2, TOPBP1, CAB39, ETAA1, CCDC88A, TAOK1, ALS2, STRADA, RICTOR","CALM1, CALM3, LTF, MAP2K2, MAP3K12, TAOK2, ATG13,
TAB1, GCN1, MLST8, DAB2IP"
"GO:0043997","histone H4K12 acetyltransferase activity",1.1432511,5,0.015,6.1e-05,0.0028,"KAT6A, HAT1, ING3, JADE1","BRPF1, KAT7, JADE2"
"GO:0005080","protein kinase C binding",1.1805818,7,0.015,6.4e-05,0.045,"AVPR1A, GRK5, ITGAV, TOP2A, YWHAG, ADAM9, HDAC9,
PDLIM5, CCDC88A","ABL1, DSP, HINT1, HSPB1, PKN1, PRKCSH, SQSTM1, PICK1,
HDAC5, TWF2, PRKD2, HDAC7, DACT2, ADCY4"
"GO:0001664","G protein-coupled receptor binding",1.3859003,4,0.005,6.4e-05,0.034,"DNAJA1, HSPA8, USP33, ARHGEF12, GPRASP2,
ARMCX5-GPRASP2","ARRB2, FCN1, FLNA, FPR1, GNA15, HSPA1A, HSPA1B,
ITGB4, POMC, PPY, PYY, SAA1, SCT, TULP3, MARCO, PICK1, ARHGEF11, STUB1,
USP20, PROK2, RSPO1"
"GO:0004386","helicase activity",1.4971146,10,0.0275,7e-05,0.0052,"BLM, DDX6, DNA2, EIF4A1, EIF4A2","DDX11, RECQL5, RECQL4, DDX23, DDX19B"
"GO:0097110","scaffold protein binding",1.3552827,9,0.0416667,7.3e-05,0.023,"BRAF, CASP8, CHUK, GRID2, HSP90AA1, IL6ST, ITPR2,
KCNH2, LRP4, P2RY1, MAP2K1, MAP3K7, CRIPT, AKAP5, NLGN4Y, NLGN1, NLGN3,
NLGN4X, PHF6","DSP, FYN, XRCC6, GRM2, KCNA5, KCNQ1, KRT5, KRT15,
NOS1, PLCG2, MAP2K2, PSAP, SRC, SYK, TCOF1, UBTF, VIM, CACNA1H, CACNA1G,
CDC37, PARK7, ATG4B, TREM2, SHANK3"
"GO:0004129","cytochrome-c oxidase activity",1.3474031,6,0.025,7.4e-05,0.0039,"","COX4I1, COX5B, COX7A1, COX7B, COX8A, CYB5A, COX2,
COX5A, COX4I2"
"GO:0033558","protein lysine deacetylase activity",1.3474031,6,0.0153883,7.6e-05,0.0068,"HDAC2, HDAC9, SIRT1","HDAC1, HDAC3, HDAC6, HDAC5, SIRT2, HDAC7"
"GO:0017116","single-stranded DNA helicase activity",1.3474031,3,0.005,7.6e-05,0.009,"DNA2, RFC3, RFC4, POLQ, DSCC1, PIF1, HELB","RFC2, CHTF18"
"GO:0016922","nuclear receptor binding",1.1976917,5,0.005,7.9e-05,0.039,"NR0B1, CRY1, HIF1A, MED1, PROX1, SMARCE1, STAT1,
TACC1, TAF1, TCF7L2, NCOA3, NRIP1, NCOA1, NR1I2, NCOR1, NCOA2, SIRT1,
NCOA7","RXRA, SMARCD3, BUD31, TADA3, TACC2, BCAS3"
"GO:0005547","phosphatidylinositol-3,4,5-trisphosphate binding",1.1976917,7,0.0151515,7.9e-05,0.039,"MYO1B, OGT, IQGAP1, ZFYVE16, FERMT2, DAPP1, RACGAP1,
KIF16B, PARD3, ARAP2","AKT1, GBF1, HIP1R, GAB2, PHLDA3, ZFYVE1, ADAP2, JPH2,
MYO1G, FUNDC2, ARAP1, PLA2G4E, COMMD1, ANXA8"
"GO:0001671","ATPase activator activity",1.2575762,6,0.0116951,8.2e-05,0.05,"ATP1B1, DNAJA1, DNAJC7, DNAJA2, DNAJB4, TOR1AIP1,
DNAJC2, DNAJC10, NKRF, DNAJC24, TOR1AIP2","DNAJB2, DNAJB1, AHSA1"
"GO:0008327","methyl-CpG binding",1.2497652,4,0.0075505,9e-05,0.0054,"ZBTB33, UHRF1, ZBTB21, TET1, CXXC4, LHX4, TET3,
ZBTB38","ERH, PRMT1, MBD1, MBD2, CHTOP, MBD3, ZBTB4,
LRWD1"
"GO:0140677","molecular function activator activity",1.3278755,2,0.0050253,9e-05,0.0075,"BLM, CAPRIN1, PTK2, PTN, NEK7","AKT2, CA9, CDKN1A, HMGA1, INCENP, MET, MAP3K9, PLCB3,
MAP2K7, HTRA1, TP53, PTTG1"
"GO:0003755","peptidyl-prolyl cis-trans isomerase activity",1.4840962,2,0.005,9.6e-05,3e-04,"NKTR, PPID, RANBP2, PPIG, CWC27, PPWD1, PPIL1,
FKBP7","FKBP1A, FKBP1B, FKBP4, PIN1, PPIA, PPIB, PPIF, PPIE,
PPIH, PPIL2, FKBP10"
"GO:0004535","poly(A)-specific ribonuclease activity",1.7965375,5,0.01,9.6e-05,0.013,"CNOT2, CNOT8, PAN2, CNOT1, CNOT7, CNOT6, PDE12,
CNOT6L, PAN3","PARN, TOE1, PNLDC1"
"GO:0070411","I-SMAD binding",1.1976917,5,0.0050505,1e-04,0.0062,"SMAD4, TGFBR1","ACVR1B, FKBP1A, SMAD6, TGFB1I1, AXIN1, SMURF1"
"GO:0016407","acetyltransferase activity",1.3819519,6,0.0075253,0.00011,0.0076,"GTF2B, KAT6A, KAT2B, NAA16, NAA15, ESCO1, ESCO2","NAA10, SPHK1, KAT5"
"GO:0046982","protein heterodimerization activity",1.1618911,6,0.028125,0.00012,0.0016,"ADRB1, AHR, ABCD2, ATP1A2, ATP1B1, BARD1, BMP6, CHUK,
CYBB, GADD45A, FMR1, GTF2A1, HIF1A, HIP1, IL12A, ITGB1, MCL1, MEF2A,
MEF2C, NR4A2, PAFAH1B1, PAFAH1B2, PDGFA, SNX1, SNX2, SRI, TAF1, TAF7,
TCF4, TLR4, TOP2A, FXR1, SMC1A, DGKD, NAE1, UBA3, SMC3, VAPB, NOLC1,
ARNT2, UBA2, TENM1, TLR6, KATNA1, LSM6, IRAK3, ZHX1, ZBTB1, ATF6, LSM5,
GCA, TENM3, METTL3, RALGAPB, RALGAPA2, SLC51B, MICU2, RALGAPA1, SOHLH1,
SRGAP2C","ADD1, ADRA1B, ATF4, BAK1, BAX, BOK, CYBA, EPAS1,
ERBB2, EXT1, HEXA, HSF1, IRAK1, ITGA3, KCNB1, KRT1, KRT10, MTTP,
CEACAM6, P4HB, PAFAH1B3, PDGFB, PPP2R1A, SLC3A2, SUPT5H, TCOF1, TP53,
USF1, USF2, XBP1, YWHAH, FZD9, IKBKG, AOC3, PSMF1, FXR2, GABBR2, ABCG1,
SAE1, KATNB1, MICU1, RRAGA, PHB2, ZHX2, SLC7A8, FBXO7, SDCBP2, TRMT112,
PGLYRP4, TENM2, RRAGD, RRAGC, ABCG4, BHLHE41, QTRT1, ALG2, PGLYRP3,
SLC51A, PEF1"
"GO:0008301","DNA binding, bending",1.2437567,6,0.0229167,0.00012,0.0076,"HHEX, HMGB1, HMGB2, TERF1, TOP1, TOP2A, HMGA2","HMGB3, HMGA1"
"GO:0042605","peptide antigen binding",1.5719703,5,0.01,0.00013,0.0067,"HFE","DHCR24, FCGRT, HLA-A, HLA-B, HLA-C, HLA-DPA1,
HLA-DPB1, HLA-DQA1, HLA-DQB1, HLA-DRA, HLA-DRB1, HLA-DRB5, HLA-E, HLA-F,
HLA-G, TAP1, TAP2, TAPBP, SLC7A5, SLC7A8"
"GO:0001540","amyloid-beta binding",1.2922463,4,0.0051294,0.00015,0.036,"CD36, GRIA1, GRIA2, ITGA2, MSR1, NGFR, PFDN4, PFDN5,
PRNP, SORL1, TGFB2, TLR2, VBP1, PGRMC1, BACE1, GSAP, COL25A1","ADRB2, AGER, APOE, ATP1A3, C1QA, CD74, CLU, CRYAB,
CST3, EPHA4, EPHB2, GRIN1, GRIN2A, ITGB2, KIR3DL1, LRPAP1, PFDN1, PFDN2,
MARCO, PFDN6, LILRB3, CLSTN1, LDLRAP1, TREM2"
"GO:0051020","GTPase binding",1.6528145,10,0.0375,0.00015,0.014,"GNB3, GOLGA4, HSP90AA1, RASA1, SPTBN1, BECN1, AIMP1,
RRAGB, ATG14, FNBP1L, ATG16L1","ENO1, FLNA, GNB1, GNB2, YBX1, ULK1, STOML2, RASIP1,
LAMTOR1, AMBRA1, RRAGD, RRAGC"
"GO:0044548","S100 protein binding",1.1055615,6,0.0102083,0.00017,0.0098,"IQGAP1","AGER, ANXA2, ANXA11, S100A1, S100A6, S100A11,
EZR"
"GO:0004532","RNA exonuclease activity",1.5398893,4,0.005,0.00017,0.011,"EXOSC9, EXOSC8, CNOT7, EXOSC3, CNOT6","EXOSC7, DCPS, EXOSC1, EXOSC4, EXOSC5, ZC3H12A,
EXOSC6"
"GO:0005546","phosphatidylinositol-4,5-bisphosphate binding",1.2699662,5,0.015625,0.00017,0.04,"ALOX15, KRIT1, HIP1, MARK1, MYO1B, TWF1, TTPA,
PICALM, FZD7, FRMPD4, PLCB1, PARD3, SESTD1, SNX18, FCHO2","ANXA2, DEFB4A, DNM2, KCNQ1, PFN1, PLCD1, SLC9A1,
TULP1, HIP1R, SYT7, RAB35, TWF2, RPH3A, PHLDA3, LDLRAP1, SDCBP2, ADAP2,
JPH2, PLEKHA4, MYO1G, GSDMD, SNX21, PLA2G4E, COMMD1, AMER2, ANXA8"
"GO:0005545","1-phosphatidylinositol binding",1.2832411,6,0.0127841,0.00017,0.014,"PICALM, EEA1, ZFYVE9, ZFYVE16, WDFY3, SNX10, WDFY1,
SESTD1","SCARB1, ZFYVE1"
"GO:0000287","magnesium ion binding",1.2815301,6,0.0102083,0.00018,0.029,"GEM, GCLC, MSH6, HPRT1, IDH1, IDH3A, IMPA1, ITGB1,
LIG4, MARK1, ME1, MAP3K5, MSH2, PRIM1, PRKACB, RAP2A, RP2, SRPK1, SRPK2,
STK3, STK4, TDG, TOP2A, WRN, DYRK2, CDC42BPA, CDC123, LATS1, OXSR1,
PDCD6, UBA2, FARSB, POLQ, MTHFD2, PAPOLA, IRAK3, FAN1, STK38L, TDP2,
STK26, SNRK, TESC, MTPAP, PRTFDC1, NLRC4, AASDHPPT, FIGNL1, PIF1, TSSK3,
NUDT12, LRRK2, DHX36, TSSK4, GEN1","ABL1, DXO, MARK2, ENDOG, EPHX2, EXTL3, EYA2, FARSA,
GSS, HMGCL, IDH2, IDH3G, FOXK2, MVK, NME1, PDE2A, PGM1, PLK1, POLR2A,
MAP2K7, S100P, SNCA, STK11, TKT, PDXK, SPHK1, MAP3K6, CIB2, ERN2, NEK6,
TPPP, TREX2, MAST1, MAST2, MOV10L1, CDC42BPG, PDXP, XYLT2, CERK, PINK1,
DCTPP1, THTPA, NUAK2, TSSK6, DIS3L2, NUDT16, SIK1, YDJC, XXYLT1, CLYBL,
NUDT8, PGP, ENDOV"
"GO:0008320","protein transmembrane transporter activity",1.5398893,2,0.0075,0.00018,0.011,"MCL1, PEX12, PEX13, PEX2","PEX10, PEX14, AP4M1, TOMM40, SEC61G, TIMM22, TOMM7,
TOMM22"
"GO:0140313","molecular sequestering activity",1.6767683,4,0.005,0.00026,0.00052,"USP9X, WDR44, XAF1, GOPC","C1R, CALR, NFKBIA, TCN1, SQSTM1, TSSC4, PRDX4,
HSPBP1, EPN1, NOSIP"
"GO:0004879","nuclear receptor activity",1.3307685,5,0.01,0.00028,0.012,"AHR, AR, NR5A2, NR3C1, NR4A2, PPARA, NR2F2, THRB,
NR1I2, NR1I3, NR1D2","ESR2, PPARD, PPARG, RARA, RXRA, RXRB, SREBF1, THRA,
VDR"
"GO:0050321","tau-protein kinase activity",1.3819519,6,0.0125505,0.00031,0.018,"GSK3B, MARK1, MARK3, TTBK2","CDK5, CSNK1D, MARK2, GSK3A, PHKG2, MARK4"
"GO:0043565","sequence-specific DNA binding",1.1708777,4,0.01,0.00032,0.0029,"CBFB, CEBPG, E2F3, EGR2, ESRRB, BPTF, FOXO1, NR5A2,
NR6A1, HHEX, HIF1A, RBPJ, SMAD4, MEF2A, MEOX2, NFE2L2, POU2F1, POU5F1,
PPARA, RAG1, RFX5, RORA, SATB1, SOX2, SP1, SP4, TAF1, TBX3, TCF7L2,
TFAM, NR2F2, NR2C2, ZBTB14, ZNF711, ZNF24, ZNF140, ZNF148, ZNF224,
PRDM2, CLOCK, ZBTB33, ZBTB18, CTCF, ZNF274, PRDM5, FOXJ3, ATF6, ZNF281,
THAP1, PRDM16, GZF1, THAP9, LHX4, ZNF300, FOXP2, CTCFL, ZBTB49, YY2","ATF4, BCL6, CENPB, CUX1, DLX4, E2F1, E2F2, EPAS1,
NR2F6, ERF, ESRRA, FOXF1, FOXF2, FOXE1, HIC1, HLX, HES1, HSF1, FOXK2,
IRF3, IRF4, IRF5, IRF6, MAPT, MEOX1, FOXO4, MSX2, POLRMT, POU3F1,
POU6F1, PPARG, RXRA, SOX9, SPI1, TBX1, TBX2, TFAP2A, TFAP4, USF1, USF2,
ZNF76, ZNF174, MAFK, ZBED1, LONP1, SOX13, MAFB, ZNF263, BATF, ARID5A,
ATF5, ZNF423, SIRT3, MAFF, SPDEF, POU2F3, VENTX, GRHL1, TBX21, FOXP3,
CHCHD2, MEIS3, CALCOCO1, ZBTB4, GRHL3, IRX1, GRHL2, PBX4, ZGPAT, OSR2,
DMBX1, IRX2, SCX"
"GO:0008047","enzyme activator activity",1.4898116,1,0.01,0.00032,0.00032,"TRIM23, ARL1, ERCC5, GMFB, MMP16, PRKCE, RFC1, XRCC5,
PRKRA, EED, CFLAR, GTF3C4, MMP24, DBF4, SUZ12, RAB3GAP2, FNIP1, KRTCAP2,
FAM47E","CASP9, DAD1, DDOST, CXCL1, MMP17, CTSA, PRKCD, PSAP,
DPM2, SAE1, PITRM1, WDR4, DBNL, DPM3, SLX4"
"GO:0008266","poly(U) RNA binding",1.6842539,9,0.06,0.00039,0.038,"FMR1, HNRNPH1, ATXN1, SSB, KHDRBS1, IFIT5, PABPC1,
RBMS3, RBM11, PNPT1","PABPC4, MCRS1, DAZAP1, DIS3L2, PATL1"
"GO:0051219","phosphoprotein binding",1.3307685,5,0.01,4e-04,0.0091,"PAFAH1B1, PKD2, PLAT, RB1, URI1, MID2, TBK1,
PHF6","IGF2R, MEN1, PIN1, PRKCSH, SNCA, SRC, YWHAB, THRAP3,
RRAGA, TBL2, APTX, PIH1D1"
"GO:0015485","cholesterol binding",1.2376147,7,0.01,4e-04,0.025,"SCARB2, SCP2, ERLIN1, OSBPL3, GRAMD1C, STARD3NL,
OSBPL8, OSBPL10, STARD4, GPR155, SLC38A9, TSPO2","ANXA6, APOD, TSPO, CD81, NPC1, STAR, SULT2B1, VDAC1,
VDAC2, SOAT2, NPC2, STARD3, TMEM97, GRAMD1B, GRAMD1A, STARD5, OSBPL5,
OSBPL7, PROM2"
"GO:0070182","DNA polymerase binding",1.1976917,7,0.0151515,0.00072,0.041,"FANCD2, HMGB1, HSP90AA1, PTGES3, POLG2, FANCI","SMARCA4, CDK2AP1, LONP1, NAT10, ACD, NABP2"
"GO:0043015","gamma-tubulin binding",1.3973069,5,0.0052083,0.00072,0.04,"BRCA2, DDX3X, OFD1, NDRG1, TUBGCP3, RACGAP1, CENPJ,
DIXDC1","PAK1, RAB11FIP5, GIT1, MARK4, B9D2, BLOC1S2"
"GO:0000146","microfilament motor activity",0.9980764,8,0.0051294,0.00072,0.036,"MYO1B, MYH13, MYO3A","ACTC1, MYH7, MYH9, MYL6, MYO1D, MYO9B, MYH14"
"GO:0008135","translation factor activity, RNA binding",1.3738228,8,0.035,0.00072,0.049,"EIF1AX, EIF2S3, EIF4A1, EIF4G2, MTIF2, EIF4G3,
EIF2S2, CPEB3","ABCF1, EEF1D, EIF4G1, EIF4E2, EIF1"
"GO:1990782","protein tyrosine kinase binding",1.3174608,6,0.0102083,0.00072,0.045,"ACVR1, BMPR2, CRK, HSP90AA1, ITGB1, NEDD9, PTPN11,
SH2B3, KHDRBS1, BANK1, CASS4, FCRL3","CD4, CDH5, DUSP3, EPHA4, PLCG2, PHYHIP, BLNK, TREM2,
PRR7, SIRPA"
"GO:0019838","growth factor binding",1.1976917,2,0.0075,0.00076,0.031,"ACVR2B, FLT1, IL6ST, LIFR, TGFBR1, NRP1, OSMR,
ACVR1C","ACVR1B, ERBB2, FLT4, NKD2"
"GO:0000049","tRNA binding",1.5158285,6,0.01,0.00081,0.041,"EEF1A1, SSB, TERT, AIMP1, EIF5B, XPOT, IFIT5,
SEPSECS, TRNT1, TRMT10C, DARS2, EIF2A, SLFN11, ALKBH8, TRMT10A, GTSF1,
TYW5, NSUN6, EIF2AK4","HSD17B10, IGHMBP2, GTPBP1, FARS2, PTCD1, YARS2,
DALRD3, PUS1"
"GO:0005178","integrin binding",1.20955,6,0.0102083,0.00093,0.012,"DST, COL4A3, ECM2, FGF2, HMGB1, TNC, IBSP, ITGA4,
ITGAV, ITGB1, ITGB3, LGALS8, PRKCA, PTK2, PTN, PTPN2, PTPRZ1, SPP1,
ADAM17, THBS1, THBS4, UTRN, VCAM1, ADAM9, EDIL3, CD226, ESM1, ADAMTS5,
JAM3, FRMD5","ACTN1, ACTN3, CALR, CD81, CD151, COL3A1, EMP2, FBLN1,
FN1, ICAM2, ICAM3, IGF1, IL1B, ITGAX, ITGB2, LAMA5, ADAM11, MYH9, P4HB,
PPIA, CX3CL1, CXCL12, SELP, SFRP2, SRC, SYK, THY1, TLN1, TSPAN4, TNXB,
VTN, VWF, ADAM15, ITGB1BP1, ISG15, FBLN5, F11R, CD177"
"GO:0051117","ATPase binding",1.3738228,8,0.0175,0.00095,0.033,"ANK2, AR, ATP1B1, ATXN3, PKD2, PLN, PPP3CA, RALA,
RALB, RDX, TAF9, TRPC1, TOR1AIP1, NUFIP1, CHMP4A, USP25, SNX10, NOP58,
DNAJC10, TMEM106B, ZNHIT6, VCPKMT, TMTC4, SLC2A13, METTL21A, TOR1AIP2,
SVIP","ATP6V1E1, ATP6V0A1, EGFR, FBL, DNAJB1, SNU13, PSEN1,
PEX19, S100A1, SNTA1, SRC, NR1H2, EZR, WFS1, ATP6V1G1, NCSTN, BBC3,
ATP6V0A4, UBXN1, PIH1D1, PEX26, DERL1, SYVN1, NKD2, SLC26A9"
"GO:0017025","TBP-class protein binding",1.3237645,5,0.0050505,0.00096,0.03,"AHR, DR1, NR3C1, GTF2A1, GTF2B, HHEX, TAF1, TAF13,
TAF1B, YEATS2","THRA, RUVBL1, DRAP1, RUVBL2"
"GO:0017134","fibroblast growth factor binding",1.2292099,7,0.01,0.001,0.05,"ITGAV, ITGB3, THBS1, API5, KL, CEP57","FGFR3, FGFR2, FGFR4, RPS2, RPS19, S100A13, FIBP"
"GO:0001216","DNA-binding transcription activator activity",1.1677494,6,0.005,0.0013,0.048,"BRCA1, E2F3, E2F5, HIF1A, PPARA","BNC1, E2F1, E2F4, IRF3, SOX10, SPI1, GRHL2,
ZNF341"
"GO:0005158","insulin receptor binding",0.8982687,5,0.005,0.0013,0.024,"PIK3R1, PTPN11, SNX1, SNX2, SNX4, CCDC88A","IGF1, INSL3"
"GO:0051018","protein kinase A binding",1.2575762,2,0.01,0.0013,0.0019,"RDX, WASF1, AKAP7, AKAP6, AKAP5, AKAP10, GSKIP,
LRRK2, CRYBG3","RARA, RPS3, EZR, WASF2, DACT2"
"GO:0017075","syntaxin-1 binding",1.2575762,3,0.005,0.0016,0.003,"DAPK1, SYT1, PRRT2, LRRK2, STXBP5","STXBP1, VAMP2"
"GO:0010485","histone H4 acetyltransferase activity",1.43723,4,0.0125758,0.0017,0.003,"BRCA2, ATF2, ING3, NAA40, NAA50","KAT5, KAT7, NAA60"
"GO:1990459","transferrin receptor binding",1.2575762,2,0.0050253,0.0017,0.0023,"CHUK, HFE, SNX1, SNX2, SNX4","CD81, IKBKG"
"GO:0005154","epidermal growth factor receptor binding",1.2832411,5,0.015,0.0018,0.046,"ERBB4, FER, HIP1, SNX1, SNX2, TGFA, SNX4,
CCDC88A","EFEMP1, GRB2, TNK2, AGR2, CBLC, FAM83B, EPGN"
"GO:0030957","Tat protein binding",1.7965375,6,0.0215909,0.0018,0.0047,"DNAJA1, NPM1, MDFIC","ACTB, SMARCA4, SMARCB1, CTDP1, TRIM32, GABARAPL1,
DLL1"
"GO:0032183","SUMO binding",1.6168837,3,0.005,0.0018,0.003,"TDG, UBA2, USPL1, SERBP1, USP25","PML, CBX4, HABP4, PELP1"
"GO:0042800","histone H3K4 methyltransferase activity",1.0779225,2,0.005,0.0018,0.0023,"KMT2A, KMT2C","KMT2D, SETD1A, KMT2B, SETD1B"
"GO:0008157","protein phosphatase 1 binding",1.1976917,1,0.005,0.0018,0.0018,"SHOC2, AKAP11","KCNQ1, PPP1R15A, SH3RF2, TPRN"
"GO:0004861","cyclin-dependent protein serine/threonine kinase
inhibitor activity",1.2575762,2,0.0051042,0.0018,0.0039,"CDKN1B, CDKN2B, KAT2B","CDKN1A, CDKN2D, HEXIM1, HEXIM2"
"GO:0005078","MAP-kinase scaffold activity",1.43723,1,0.005,0.0022,0.0022,"MAP2K1, IQGAP1, MAPK8IP3, SH3RF1, DUSP19","MAP2K2, MAPK8IP1, MAPK8IP2"
"GO:0008276","protein methyltransferase activity",1.7965375,2,0.0115909,0.0022,0.0039,"FAM98A, N6AMT1, METTL21A, FAM98B","PRMT1, CARM1, NTMT1, TRMT112, SIRT7, METTL22"
"GO:0015171","amino acid transmembrane transporter activity",0.8982687,1,0.0181818,0.0022,0.0022,"SLC38A2, SLC6A15, SLC7A3, SLC38A9","SLC1A4, SLC1A5, SLC6A12, SLC7A1, SLC7A5, PDPN,
SLC6A14, SLC7A8, SLC38A4, SLC38A5, SLC43A2"
"GO:0097602","cullin family protein binding",1.1121423,2,0.0100253,0.0023,0.044,"DCUN1D4, BTBD1, DCUN1D1, KCTD9, KLHL9, KCTD6","DDB1, KLHL21, RBX1, CCDC22, ANAPC11, KCTD17,
KCTD21"
"GO:0098505","G-rich strand telomeric DNA binding",1.0779225,1,0.005,0.0023,0.0023,"HNRNPA2B1, TERF1, POT1","TERF2, NABP2, CTC1"
"GO:0003950","NAD+ ADP-ribosyltransferase activity",1.3474031,4,0.0051042,0.0025,0.048,"PARP4, TNKS, SIRT1, TIPARP, PARP14, ZC3HAV1, PARP11,
TNKS2, PARP9, PARP15","SIRT2, SIRT4, SIRT3, SIRT6, PARP10"
"GO:0031072","heat shock protein binding",1.2437567,5,0.010101,0.0027,0.04,"GPR37, HSPA8, PPID, TPR, DNAJC7, DNAJC6, DNAJC9,
METTL18, METTL21A","DAXX, FKBP4, HTT, HSF1, HSPA1A, HSPA1B, HSPA1L,
ITGAM, ITGB2, LIMK1, ZFP36, STUB1, LMAN2, CDC37, PDXP, METTL22, CAMKMT,
METTL23"
