"ID","Term_Description","Fold_Enrichment","occurrence","support","lowest_p","highest_p","Up_regulated","Down_regulated"
"GO:0140678","molecular function inhibitor activity",1.2497652,4,0.0050253,0.0027,0.0075,"CDKN1B, PPP1R2, KCNAB1, SPOP, USP10, NOLC1, FBXO5,
CHMP3, BEX1","CDKN1A, CDKN1C, TIMP2, FRAT1, ADRM1, U2AF2,
SERPINA12"
"GO:0003756","protein disulfide isomerase activity",1.4698943,4,0.005,0.0028,0.0073,"ITGB3, PDIA4, PIGK, GLRX2, ENOX1, TMX1, TXNDC5","P4HB, QSOX1"
"GO:1990825","sequence-specific mRNA binding",1.4698943,6,0.0142992,0.0028,0.011,"DHX9, DHFR, ETF1, FMR1, NOVA1, SSB, TYMS, LIN28A","RBM24"
"GO:0004722","protein serine/threonine phosphatase activity",1.2138767,5,0.010101,0.0029,0.033,"PPM1A, PPM1B, PPP1CB, PPP1CC, PPP1R3C, PPP3CA,
CDC14B, CDC14A, MTMR4, PDP1, RPAP2, UBLCP1, PPM1L, PPM1K, PPTC7","PPM1G, PPP1CA, PPP4C, PPP5C, MTMR3, BCKDK, CTDNEP1,
MTMR14, TIMM50, PGAM5"
"GO:0050839","cell adhesion molecule binding",1.1677494,4,0.0076042,0.0032,0.047,"CD1D, CPE, ITGA4, ITGB1, ITGB3, PTPN11, VCAM1, NRXN3,
NRXN1, CD226, NLGN4Y, NLGN1, NPTN, NLGN3, NLGN4X","ADAM8, CDH1, FGB, ITGAL, ITGB2, ITGB7, JUP, PTPRF,
EZR, PKP3, CDHR2"
"GO:0030374","nuclear receptor coactivator activity",1.3923166,2,0.0051294,0.0032,0.045,"ETS1, FGF2, MED1, SS18, TACC1, TMF1, NCOA1, MED17,
NCOA2, KDM4C, CCAR1, TRERF1, DCAF6, CNOT6, CCDC62, SFR1, PPARGC1B,
NCOA7","ACTN1, ELK1, HMGA1, PKN1, RNF4, BUD31, RBM14, CARM1,
NCOA6, ATXN7L3, CALCOCO1, ZMIZ2, HELZ2"
"GO:1990404","NAD+-protein ADP-ribosyltransferase activity",1.3687905,2,0.0051042,0.0033,0.046,"PARP4, TNKS, SIRT1, TIPARP, PARP14, ZC3HAV1, PARP11,
PARP8, TNKS2, PARP15","SIRT2, SIRT4, SIRT3, SIRT6, PARP12, PARP10"
"GO:0005324","long-chain fatty acid transmembrane transporter
activity",1.7965375,2,0.005,0.0036,0.0039,"CD36, ABCD3","ABCD1, FABP4, FABP5, SLC2A1, SLC27A5, SLC27A4,
SLC27A2, MFSD2A, SLC27A1"
"GO:0034450","ubiquitin-ubiquitin ligase activity",1.4971146,4,0.01,0.0039,0.0068,"UBE2K, UBR5, PELI2, PELI1","RBX1, STUB1, UBOX5, PPIL2, PRPF19, ANAPC11"
"GO:0030371","translation repressor activity",1.1976917,3,0.05,0.0041,0.0081,"FMR1, SERBP1, PAIP2, TRIM71","CIRBP, EIF4EBP1, IFRD2, DAPL1"
"GO:0140463","chromatin-protein adaptor activity",1.4971146,3,0.005,0.0042,0.0053,"NBN, RAD17, XIST, TOPBP1, HTATSF1, EPC1, GLYR1","MDC1, RHNO1, PHF13"
"GO:0003676","nucleic acid binding",1.293507,1,0.0050505,0.0042,0.0042,"ETS1, FOXO1, TDG, HMGA2, RYBP, UHRF1, RNASEH1","IMPDH1, MECP2, FOXO4, NFATC1, PA2G4, PPARG, TRIM27,
SULT2B1, EHD4, EHD2, DOT1L"
"GO:0015026","coreceptor activity",1.1624654,6,0.0050253,0.0048,0.039,"ACVR2A, CD28, IL1RAP, IL6ST, ITGA4, ITGAV, ITGB1,
ITGB3, LRP6, NGFR, ROR1, RYK, TGFBR3, NRP1, FCRL1","ENG, ERBB2, IL2RB, IL2RG, LRP5, RAMP2, IL17RC"
"GO:0043531","ADP binding",1.4222588,2,0.0075,0.0049,0.0067,"GCLC, GLUD1, GLUD2, MSH6, ME1, MSH2, MYO6, MYO3A","ABCD1, MYH9, MYO9B, PPP5C, PRKAG1, TAP1, LONP1,
ABCG1, PRKAG2, NOD2, MYO18A"
"GO:0048156","tau protein binding",1.2437567,8,0.015,0.0056,0.01,"DYRK1A, HSP90AA1, PICALM","APOE, CLU, MARK2, FYN, SNCA, HDAC6"
"GO:0001046","core promoter sequence-specific DNA binding",0.9673663,4,0.0100253,0.0056,0.0098,"NR3C1, NPM1, TAF4, AGO2","HDAC1, TP53, ZBTB17"
"GO:0001217","DNA-binding transcription repressor activity",1.3819519,5,0.005,0.0059,0.0098,"HIF1A, YY1, E2F8, E2F7, ZNF418","RARA, SPI1, TCF7, SOX13, ZBTB7B"
"GO:1990380","K48-linked deubiquitinase activity",1.3819519,2,0.0051042,0.0059,0.0059,"ATXN3, USP9X, USP13, USP8, USP15, DESI2, YOD1","OTUD5, OTUD7B, USP36"
"GO:0031432","titin binding",1.3474031,1,0.005,0.0068,0.0068,"CALM2, CAMK2D, CAPN3, MYBPC1, ANKRD1","CALM1, CALM3, TRIM63, ANKRD23"
"GO:0140311","protein sequestering activity",1.3128543,3,0.005,0.0075,0.01,"INSIG1, YWHAG, INSIG2, IMPACT, USP38","CDKN1A, CTNND1, SFN, SMAD6, NFKBIA, SEC14L1, SMO,
SPI1, TARBP2, LAPTM5, SQSTM1, DDX56, SESN2, LRRC15"
"GO:0016791","phosphatase activity",1.4757272,5,0.0050505,0.0075,0.015,"ATP1A2, DUSP5, PPP1CB, PPP1CC, PTPRJ, PTPRO, DUSP11,
DUSP12, SACM1L, PTPN22, PXYLP1","DUSP3, DUSP8, EPHX2, PPP1CA, PPP5C, SBF1, DUSP23,
PANK4, DUSP16, DUSP15, DUSP18, PGAM5"
"GO:0016279","protein-lysine N-methyltransferase activity",1.5398893,4,0.0076042,0.0078,0.014,"EZH2, SETD2, SMYD2, VCPKMT, SETD6, SETD7,
METTL21A","EHMT2, METTL13, METTL22, EHMT1, EEF2KMT"
"GO:0008142","oxysterol binding",1.4115652,3,0.0050505,0.0078,0.011,"GPR183, INSIG1, RORA, INSIG2","EPHX1, GAS1, SMO, VDAC1, VDAC2, TMEM97, TMEM199"
"GO:0000979","RNA polymerase II core promoter sequence-specific DNA
binding",1.646826,1,0.005,0.009,0.009,"GTF2A1, GTF2B, POU2F1, STAT1, TAF1, TBPL1, RFX7","FOS, HDAC1, RELA, RUVBL2"
"GO:0043014","alpha-tubulin binding",1.4867896,2,0.0050253,0.009,0.0095,"BBS4, FNTA, SPAST, OFD1, DLEC1, EML4, SETD2, RACGAP1,
INO80, ARL8B, TRIM36, TAOK1, DIP2B, TTLL7, DNAL1, EFHC1","FYN, SNCA, HDAC6, ENKD1, ARL8A, WASH3P, FAM110C,
WASH6P"
"GO:0004860","protein kinase inhibitor activity",1.4757272,2,0.005,0.01,0.021,"CDKN1B, GMFB, NCK1, NPM1, DNAJC3, TAOK3, GSKIP, MBIP,
DEPTOR, SPRY4, DUSP19","CDKN1A, CDKN1C, SNCA, YWHAB, SOCS1, SOCS3, MAPK8IP1,
HEXIM1, DUS2, PARVA, PRKRIP1, AKT1S1"
"GO:0030742","GTP-dependent protein binding",1.5569992,3,0.005,0.01,0.014,"AP1G1, EEA1, AP3B1, RAPGEF5, DNM1L, RAPGEF6","RAB5B, RAB32, ARFIP2, RAB38, PARD6A, HPS6, RAB34"
"GO:0003777","microtubule motor activity",1.0265928,3,0.015,0.011,0.021,"CENPE, KIF5B, KIF5C, KIF11, APPBP2, STARD9","DNAL4, KIF26A"
"GO:0004467","long-chain fatty acid-CoA ligase activity",1.2832411,2,0.005,0.011,0.012,"ACSL3, ACSL4, ACSL6","ACSL1, SLC27A5, SLC27A4, SLC27A3, SLC27A2, ACSF2,
SLC27A1"
"GO:0043495","protein-membrane adaptor activity",1.6682134,2,0.005,0.011,0.014,"LPL, TPR, AKAP6, NUP153, PDCD6, ATG14, ATG16L1","MYH9, CIB1, RRAGA, LAMTOR1, PEX26, RRAGC"
"GO:0030331","nuclear estrogen receptor binding",1.2575762,1,0.0050505,0.011,0.011,"MED1, PPID, STRN, TACC1, NRIP1, NCOA1, LATS1, CNOT1,
DCAF13, NSD1, LCOR, CCDC62, PPARGC1B","ARID5A, PADI2, NCOA6, WBP2, WIPI1, MMS19, DDX54,
PAGR1"
"GO:0034237","protein kinase A regulatory subunit binding",1.5569992,3,0.005,0.011,0.014,"RYR2, AKAP1, AKAP6, AKAP5, PJA2, AKAP9, ARFGEF2,
ARFGEF1, GSKIP, ACBD3","KCNQ1, PRKACA, EZR"
"GO:0031489","myosin V binding",1.1976917,4,0.0051042,0.011,0.014,"RAB3B, RAB6A, RAB10, RAB14, RAB39B","RAB8A, RAB3A, RAB11B, RAB3D, RAB25"
"GO:1904047","S-adenosyl-L-methionine binding",1.3174608,2,0.0116951,0.011,0.029,"TPMT, ZCCHC4, METTL5, N6AMT1, METTL3, METTL14,
SUV39H2, SETD6","PRMT1, FTSJ1, PCIF1"
"GO:0003774","cytoskeletal motor activity",1.43723,4,0.0101042,0.011,0.018,"KIF2A, KIF5A, MYO6, GPR88, KIF15","KIF1A, KIF3C, KLC1, MYL6, PIN1, KIF1C, MYL6B"
"GO:0001221","transcription coregulator binding",1.1378071,4,0.0103125,0.011,0.021,"NR5A2, PAX6, RORA, SP1, CTCF, CBX3, CHD6","CHD4, FOS, GATA2, HMGA1, LMO2, PPARG, RXRA, SMARCA4,
SMARCD3, SREBF1, UBE2I, CREB3"
"GO:0004867","serine-type endopeptidase inhibitor activity",1.0646148,1,0.005,0.012,0.012,"SERPINA3, SERPINA5, SERPINE2, WFDC2","ANXA2, SERPING1, FURIN, SERPINA1, SERPINB6,
SERPINB13, SERPINF2, SERPINB4, SLPI, SPINT2, SPINK5, SERPINB12"
"GO:0004721","phosphoprotein phosphatase activity",1.3128543,1,0.005,0.014,0.014,"DLG1, MTM1, PPP1CC, PPP2R5A, PTPN11, PTPN12","CDC25B, DUSP9, PPP1CA, PTPA, PPP2R5D, PPP5C, PTPRS,
CTDP1, PDXP, PPM1H, DUSP26, DUSP16, TIMM50"
"GO:0030971","receptor tyrosine kinase binding",1.3474031,2,0.0050253,0.015,0.02,"ANGPT1, ANGPT2, LRP4, NCK1, PTPN2, PTPN14, MAP3K7,
CPNE3, SOCS5, DOCK4","DUSP3, ERBB2, GAS6, ITGAX, TP53, HYAL2, SQSTM1,
PITPNM1, TOB1, ANGPT4, PITPNM2, ELMO2, PITPNM3, FIZ1"
"GO:0048306","calcium-dependent protein binding",1.209913,3,0.005,0.015,0.032,"ANXA1, CALM2, STX2, MBL2, CPNE3, PDCD6IP, PDCD6,
MASP2, S100PBP","ANXA2, ANXA6, ANXA11, MYO1D, NOS1, MASP1, RAC3,
S100A6, S100A11, S100P, SLC9A1, VAMP2, TNNI3, CABP1, STMN2, CHP1,
SEC31A, NSMF, VPS37C, CD177, VPS37B, ALG2, SLC24A4, PEF1"
"GO:0008307","structural constituent of muscle",1.0343701,3,0.0050505,0.017,0.025,"ASPH, CAPN3, DMD, MYBPC1, NEB, TTN, MYOT, SYNM,
NEXN","ACTN3, KRT19, MYH11, MYL3, MYL5, MYL6, MYOM1, MYOM2,
MYL9, MYL6B"
"GO:0051019","mitogen-activated protein kinase binding",1.3738228,7,0.01,0.018,0.05,"NBR1, PRKG2, PTPRJ, TPR, SIRT1, CDK5RAP3","ABL1, ACE, MAPK7, MICAL2, TNIP1, ATF7, DUSP16"
"GO:0005507","copper ion binding",1.0888106,1,0.005,0.018,0.018,"ATP7A, DCT, PRNP, S100A5","AOC1, ANG, ATOX1, LOXL2, P2RX4, S100A12, S100A13,
SNCA, SOD1, TP53, TYR, AOC3, CCS, COX17, PARK7, COMMD1"
"GO:0030165","PDZ domain binding",1.1311532,1,0.0052083,0.019,0.019,"ADRB1, CLCN3, GRIA1, GRID2, SDC2, SLC9A3, ADAM17,
TGFBR3, FZD3, FZD1, FZD7, FZD8, ARHGAP29, CRIPT, RAPGEF2, DOCK4, KIF14,
NLGN1, CADM1, GNG12, KIDINS220, PLEKHA1, CXXC4","FZD2, GNG5, LLGL2, MAP2K2, PSEN1, SSTR2, F11R, SNTG2,
SLC26A6, USHBP1, TMEM88"
"GO:0019706","protein-cysteine S-palmitoyltransferase activity",1.6842539,2,0.0075,0.019,0.024,"ZDHHC17, ZDHHC2, ZDHHC20, ZDHHC21","GLUL, YKT6, ZDHHC5, ZDHHC8, ZDHHC9, ZDHHC3, ZDHHC7,
ZDHHC11, ZDHHC18, ZDHHC12, ZDHHC19"
"GO:0004601","peroxidase activity",1.43723,2,0.0340909,0.022,0.024,"GPX7, PXDN, IPCEF1, GPX8","HBA2, HBB, MPO, PRDX1, PRDX5, SESN2, TXNDC17,
CYGB"
"GO:0003785","actin monomer binding",0.9980764,3,0.005,0.024,0.04,"PRKCE, TWF1, LIMA1","ABL1, MYL3, MYL4, NOS3, PFN1, CORO1A, TWF2"
"GO:0005109","frizzled binding",1.3973069,3,0.005,0.024,0.032,"LRP6, MYOC, NDP, RYK, SFRP1, FZD1, FZD7","DVL1, DVL2, DVL3, WNT2, WNT3, BAMBI, RNF43"
"GO:0035035","histone acetyltransferase binding",1.0105523,1,0.005,0.024,0.024,"MEF2A, PAX6, STAT1, TAF7, EID1","SIRT2, FOXP3, ZBTB7A, BCAS3"
"GO:0000166","nucleotide binding",1.3738228,2,0.005,0.024,0.031,"APAF1, CDC6, ORC4, ORC5, POLA1, CHD1L, APLF","LTB4R, IMPDH2, NUBP1, DHRS3, NUBP2, CHFR"
"GO:0008168","methyltransferase activity",1.5398893,1,0.005,0.027,0.027,"PRMT3","COMT, GAMT, PRMT1, MGMT, EHMT1"
"GO:0035591","signaling adaptor activity",1.1477878,2,0.0103125,0.029,0.039,"CRK, DDX3X, FMR1, CAPRIN1, AIM2, ABI1, ABI2, KHDRBS1,
BANK1, CDC42SE2","HCLS1, MYD88, AXIN1, IKBKG, HAX1, SH2B2, SCRIB,
LDLRAP1, BLNK, MAVS, ZDHHC11, SLA2, DAB2IP"
"GO:0045296","cadherin binding",1.3009409,2,0.0340909,0.031,0.038,"ACVR1, APC, BMPR2, CDH13, CD46, PTPN11, PTPRJ, PTPRO,
TRPC4, PROM1, NDRG1, CTNNA3","CTNNA1, CTNND1, JUP, P2RX4, PTPRH, OLFM4, PTPRT,
FXYD5, TBC1D2"
"GO:0016409","palmitoyltransferase activity",1.6967298,1,0.005,0.031,0.031,"ZDHHC17, ZDHHC2, ZDHHC13, ZDHHC6, ZDHHC20,
ZDHHC21","ZDHHC5, ZDHHC1, ZDHHC8, ZDHHC9, ZDHHC3, ZDHHC4,
ZDHHC7, ZDHHC14, ZDHHC18, ZDHHC16, ZDHHC12"
"GO:0000175","3’-5’-RNA exonuclease activity",1.3973069,1,0.01,0.031,0.031,"CNOT8, PAN2, XRN2, DIS3, CNOT7, PNPT1, DIS3L,
PDE12","ISG20, POLRMT, EXOSC7, USB1, TOE1, DIS3L2"
"GO:0032452","histone demethylase activity",1.0779225,1,0.0052083,0.038,0.038,"KDM5A, KDM6A, UTY, KDM4C, KDM7A, KDM1B","KDM5C, KDM4A, KDM2A, KDM4B, KDM6B, JMJD6"
"GO:0070888","E-box binding",0.8291711,3,0.0050505,0.04,0.043,"AHR, SNAI1, TCF4, ZEB1, CLOCK","ASCL2, GATA3, HES1, MAX, PER1, PPARG, SREBF2, TCF15,
TFAP4, BHLHE41, ATOH8, CIART, SCX"
"GO:0031624","ubiquitin conjugating enzyme binding",1.5719703,2,0.0051294,0.041,0.043,"PPARA, ZMYM2, ARIH2, ARIH1, RNF125","AUP1, FOXL2"
"GO:0030291","protein serine/threonine kinase inhibitor
activity",1.5719703,2,0.0051294,0.041,0.043,"DEPTOR, SPRED1, SPRED2","AKT1, CIB1, RPTOR, AKT1S1"
"GO:0005102","signaling receptor binding",1.1893744,1,0.0181818,0.047,0.047,"ALCAM, ANGPT2, ANXA1, AR, C5, CD22, CD58, DIAPH2,
EDN3, F2R, FLT3LG, MSTN, GDNF, GFRA1, HFE, INHA, JAK2, LIF, LPL, LRP6,
MBL2, NCK1, NPPC, NTF3, P2RX7, SERPINE2, PKD2, PLAT, PTPRC, RASA1, SCP2,
SRI, TGFB2, TLR4, TRPC1, FZD1, TRIM24, AKAP9, TLR6, TNFSF13B, ARPP19,
CD160, IL1RAPL1, GLMN, CADM1, PANX1, RAB8B, LEPROT, BANK1, SCYL2,
CAPRIN2, TRAK2, ANKRD13C","ADM, ANG, APOE, ARRB2, ASIP, C3, CD70, CDH5, CLU,
CNTFR, CSNK2B, CTNND1, DPP4, DVL3, EFNA1, ENSA, DMTN, ERBB2, F2RL1, FGB,
FKBP1B, FN1, GAS6, GLA, CXCL1, GSK3A, GUSB, HLA-A, HLA-B, HLA-E, HLA-G,
HNF4A, HSPA1A, HSPA1B, ICAM3, IGFBP4, IGFBP6, INSL3, KNG1, LHB, LRPAP1,
LTB, MYO1C, NRTN, P2RX4, PDGFRB, PEX14, PLA2G1B, PLAUR, POMC, PTPA,
PSPN, PRTN3, RARA, RARRES2, CCL17, CX3CL1, CXCL12, SMARCD3, SRC, SYK,
TYROBP, WNT7A, BAG6, TNFSF13, TNFSF12, TNFSF9, APLN, MAP7, PICK1, PDPN,
GIPC1, HCST, NMU, TMED1, PARK7, ICOSLG, ABCA12, RND1, PCSK1N, WIPI1,
CHRNA10, DDX54, WNT5B, AMN, WNT3A, IGFL2, IL27, RSPO1, IGFL3"
"GO:0008757","S-adenosylmethionine-dependent methyltransferase
activity",1.5398893,1,0.005,0.048,0.048,"PCMTD1","SUV39H1, RRP8, LCMT1, PRMT7, MEPCE"
"GO:0070273","phosphatidylinositol-4-phosphate binding",1.3474031,1,0.005,0.048,0.048,"PLA2G4A, ARFIP1, GOLPH3, PLEKHA3, PLEKHA8, SESTD1,
OSBPL8","ARFIP2, LANCL2, JPH2, PLEKHF1, GSDMD, OSBPL5,
PLA2G4E, DAB2IP"
